I have flu,"Common flu symptoms include fever, chills, muscle aches, cough, congestion, runny nose, headaches, and fatigue.",2024-12-09 21:26:03
Symptoms of flu,"Common flu symptoms include fever, chills, muscle aches, cough, congestion, runny nose, headaches, and fatigue.",2024-12-09 21:27:34
Symptoms of fever,"Common symptoms of fever include elevated body temperature, chills, sweating, headache, muscle aches, weakness, and dehydration.",2024-12-09 21:27:40
"I have cold, fever , which disease i have","Common cold symptoms include runny or stuffy nose, sneezing, sore throat, cough, congestion, mild fever, and watery eyes.",2024-12-09 21:31:34
symptoms of fever,"Common symptoms of fever include elevated body temperature, chills, sweating, headache, muscle aches, weakness, and dehydration.",2024-12-09 21:32:06
I feel very cold and tired,These symptoms might indicate hypothyroidism. It's best to see a healthcare professional for proper diagnosis and treatment.,2024-12-09 21:35:23
